{
  "allowed_edit_paths": [
    "app.py"
  ],
  "case_id": "repair-012-bool-is-not-count",
  "expected_escalation_reason": null,
  "expected_outcome": "VERIFIED_REPAIR",
  "forbidden_edit_paths": [
    ".github/**",
    "factory/**",
    "MANIFEST.sha256",
    "poetry.lock",
    "package-lock.json",
    "pnpm-lock.yaml",
    "yarn.lock"
  ],
  "gold_replacements": [
    {
      "new_text": "if isinstance(value, bool) or not isinstance(value, int):",
      "old_text": "if not isinstance(value, int):",
      "path": "app.py"
    }
  ],
  "hidden_test_ref": "factory/evals/hidden-tests/provider-repair-v1/repair-012-bool-is-not-count/test_hidden.py",
  "schema_version": "1.0"
}
