{
  "allowed_edit_paths": [
    "app.py"
  ],
  "case_id": "repair-002-clamp-upper-bound",
  "expected_escalation_reason": null,
  "expected_outcome": "VERIFIED_REPAIR",
  "forbidden_edit_paths": [
    ".github/**",
    "factory/**",
    "MANIFEST.sha256",
    "poetry.lock",
    "package-lock.json",
    "pnpm-lock.yaml",
    "yarn.lock"
  ],
  "gold_replacements": [
    {
      "new_text": "return min(100, max(0, value))",
      "old_text": "return max(0, value)",
      "path": "app.py"
    }
  ],
  "hidden_test_ref": "factory/evals/hidden-tests/provider-repair-v1/repair-002-clamp-upper-bound/test_hidden.py",
  "schema_version": "1.0"
}
