{
  "allowed_edit_paths": [
    "app.py"
  ],
  "case_id": "repair-004-html-escape-ampersand",
  "expected_escalation_reason": null,
  "expected_outcome": "VERIFIED_REPAIR",
  "forbidden_edit_paths": [
    ".github/**",
    "factory/**",
    "MANIFEST.sha256",
    "poetry.lock",
    "package-lock.json",
    "pnpm-lock.yaml",
    "yarn.lock"
  ],
  "gold_replacements": [
    {
      "new_text": "return html.escape(text, quote=False)",
      "old_text": "return text.replace(\"<\", \"&lt;\").replace(\">\", \"&gt;\")",
      "path": "app.py"
    }
  ],
  "hidden_test_ref": "factory/evals/hidden-tests/provider-repair-v1/repair-004-html-escape-ampersand/test_hidden.py",
  "schema_version": "1.0"
}
